{
  "schema": "harness.expert-request.v1",
  "request_id": "expert-request-1",
  "run_id": "run-1",
  "snapshot_id": "snapshot-2",
  "snapshot_revision": 2,
  "decision_id": "decision-2",
  "created_at": "2026-08-13T16:00:00Z",
  "expires_at": "2026-08-13T17:00:00Z",
  "signature": "abcdef0123456789abcdef0123456789abcdef0123456789abcdef0123456789",
  "category": "architecture",
  "question": "Which invariant should govern the conflicting implementation paths, and what evidence would establish the correct resolution?",
  "context": {
    "goal": "Resolve the named architectural conflict without changing controller custody or the approved scope.",
    "constraints": [
      "The response is advisory and cannot execute a controller action.",
      "Use only the bounded evidence supplied by the controller."
    ],
    "required_output": [
      "State the governing invariant.",
      "Explain the evidence-backed resolution.",
      "List any missing evidence or human authority."
    ]
  },
  "evidence_refs": ["finding-1", "validation-7"]
}
